{
  "agfFormatVersion": 1,
  "id": "S019",
  "title": "Authority Hand-Off + Snapshot Resync + HUD Restart Hint + Plain Inspect Tail",
  "status": "archived",
  "startedAt": null,
  "archivedAt": null,
  "stories": [
    {
      "id": "S019-1",
      "title": "`10.10` Authority hand-off + client prediction + reconciliation — project-local `network-drone-sync-system.ts` reconciles the local…",
      "status": "implemented",
      "summary": "`10.10` Authority hand-off + client prediction + reconciliation — project-local `network-drone-sync-system.ts` reconciles the local `player.drone` with the server-owned `player.<options.playerId>`. `beacon-world/project.json` declares `\"static\"` and `\"connected\"` profiles; `src/app.ts` auto-selects `\"connected\"` when `?networked=1&server=...` is on, hoists `playerId` once so the adapter and sync system agree. - Client-side prediction: `PlayerInputSystem` in networked mode now also moves the local drone immediately on input (in addition to emitting `intent.move`), so the player sees instant motion. - Server reconciliation: the sync system measures XZ drift between the local drone and the server snapshot. When drift exceeds `snapThresholdUnits` (default 1.5 — set by teleports / respawns), it snaps. Below the threshold it exponentially lerps at `reconcileRate` (default 12 / s) so prediction errors melt away smoothly. - Server constants updated: tick defaults to 30 Hz (down from 60 — clients no longer need raw frame rate because of prediction) and `PLAYER_SPEED` lifted to 3.5 to match `PlayerControlled.speed`, so prediction stays in lockstep with the authoritative integration. - Input release: `PlayerInputSystem` now emits a final `[0, 0]` intent the frame the keys are released, so the server stops driving the player when the client lets go. - Four unit tests cover the mirror, wrong-id, client-authority and missing-local-drone paths; two new `PlayerInputSystem` cases prove the `[0, 0]` release intent and the deduped emission. The multi-client e2e gained an extra assertion that alpha's `player.drone.Transform.position[0]` moves while bravo's stays at zero — proving authority hand-off across the wire.",
      "verification": [
        "legacy import — see sprint notes[] for the original sprint-level verification"
      ]
    },
    {
      "id": "S019-2",
      "title": "`10.12` Resync on snapshot gap — `WsNetworkAdapter` now compares each inbound `world.snapshot.sequence` against the previous one.",
      "status": "implemented",
      "summary": "When the sequence number jumps (server restart, dropped frames, out-of-order delivery) it logs `snapshot gap: expected N, got M; resyncing`, flushes every server-owned entity via `entity.delete` and lets the next snapshot re-create them. A new `snapshotGapCount()` field on the handle exposes the counter. `lastSequence` is also reset on the close path so a reconnect always starts fresh. New unit test drives the path with a fake `WebSocket` and proves: out-of-sequence snapshot drops the orphaned `player.echo`; the next in-sequence snapshot restores it.",
      "verification": [
        "legacy import — see sprint notes[] for the original sprint-level verification"
      ]
    },
    {
      "id": "S019-3",
      "title": "`13.16` HUD restart affordance — `health-hud.ts` now splits the `ROUND COMPLETE` line into a title + dimmer `Press R to restart` hint.",
      "status": "implemented",
      "summary": "Each line carries its own `data-testid` (`hud-round-complete`, `hud-round-restart-hint`) so e2e can assert on them independently. Active only when `RoundState.phase === \"complete\"`.",
      "verification": [
        "legacy import — see sprint notes[] for the original sprint-level verification"
      ]
    },
    {
      "id": "S019-4",
      "title": "`E.9` `engine inspect --tail N` for plain inspect — new `tailInspectResult(result, tail)` truncates `scene.entities` to the last N while…",
      "status": "implemented",
      "summary": "`E.9` `engine inspect --tail N` for plain inspect — new `tailInspectResult(result, tail)` truncates `scene.entities` to the last N while preserving `matchedEntityCount`. `formatInspection` annotates the human output: `Showing last N of M (K hidden by --tail).`. `cli.ts` threads `--tail` through both the diff path (already supported) and the plain inspect path. Four new tests cover undefined / N / 0 / format-string.",
      "verification": [
        "legacy import — see sprint notes[] for the original sprint-level verification"
      ]
    },
    {
      "id": "S019-5",
      "title": "`13.X` Multiplayer discoverability hint — when the project is Beacon World and the user is not currently networked, the status panel renders…",
      "status": "implemented",
      "summary": "`13.X` Multiplayer discoverability hint — when the project is Beacon World and the user is not currently networked, the status panel renders a collapsible `Play multiplayer` block with the `backend:node:serve` command and two pre-built links (`Open as alpha` / `Open as bravo`). When already networked, the panel shows the connected URL + player id so two-tab setups are self-explanatory without reading docs.",
      "verification": [
        "legacy import — see sprint notes[] for the original sprint-level verification"
      ]
    },
    {
      "id": "S019-6",
      "title": "`10.13` Remote-player visibility — new project-local `remote-presence-decorator-system.ts` watches `Presence + Networked` entities and, for…",
      "status": "implemented",
      "summary": "`10.13` Remote-player visibility — new project-local `remote-presence-decorator-system.ts` watches `Presence + Networked` entities and, for everything that is server-authority and NOT the local player, attaches a `MeshRenderer` (drone.glb + drone.material with a per-player palette color via stable hash) and a `Transform.scale` of `[0.7, 0.7, 0.7]` when missing. Idempotent: only writes when fields are absent, so the renderer's GLB cache is not invalidated each frame. Five unit tests cover the decorate, skip-local, no-overwrite, ignore-client-authority and stable-color paths.",
      "verification": [
        "legacy import — see sprint notes[] for the original sprint-level verification"
      ]
    }
  ],
  "followUps": [
    "Remote players are visible but their `Transform.position` is overwritten every server tick with no smoothing — at 30 Hz that's perceivable as a 30 ms cadence jitter on unstable networks. Sprint 20 candidate `10.13.5` will add an interpolation buffer (render past server time, store last N snapshots with timestamps) for production-grade smoothness.",
    "`10.5` C#/.NET reference skeleton still pending.",
    "`13.12` Sound pings still pending."
  ],
  "notes": [
    "Deliverables: `examples/beacon-world/src/systems/network-drone-sync-system.ts` (snap threshold + lerp reconciliation); `examples/beacon-world/src/systems/remote-presence-decorator-system.ts`; `examples/beacon-world/tests/unit/network-drone-sync-system.test.ts`; `examples/beacon-world/tests/unit/remote-presence-decorator-system.test.ts`; `engine/runtime/player-input-system.ts` (local prediction in networked mode, `[0, 0]` release intent, dedupe); `examples/backends/node-world-server/src/world.ts` (`PLAYER_SPEED = 3.5`); `examples/backends/node-world-server/src/transport-ws.ts` (default `tickHz = 30`); `examples/beacon-world/project.json` (`profiles: [\"static\", \"connected\"]`); `examples/beacon-world/src/ui/health-hud.ts` (`hud-round-complete` + `hud-round-restart-hint`); `engine/runtime/network/ws-network-adapter.ts` (gap detection, `snapshotGapCount`); `engine/tools/inspect/project-inspect.ts` (`tailInspectResult`, hidden-count annotation in `formatInspection`); `engine/tools/cli.ts` (threads `--tail` through plain inspect); `src/app.ts` (auto-`connected` profile, hoisted `playerId`, drone-sync registration, status-panel multiplayer hint); `tests/e2e/multiclient-roundtrip.spec.ts` (asserts local drone mirror + bravo drone stationary); Tests: `tests/unit/ws-network-adapter.test.ts` (+1 gap resync), `tests/unit/project-inspect-stable.test.ts` (+4 tail cases)",
    "Verification: `engine check examples/hello-3d` and `examples/beacon-world`: green.; Sprint-close `npm run preflight`: typecheck clean, 155 Vitest tests across 23 files, vite build OK, 11 Playwright e2e tests including the strengthened multi-client backend round-trip.",
    "Goal Recap: The local drone now moves under server authority while still carrying its local components (Carrier, Health, Respawnable, MeshRenderer). Pickup, hazard, signal and round systems keep working unchanged; the player just doesn't fight against a stationary drone any more.; A snapshot-sequence gap is recoverable: the client deletes its server-owned cache and rebuilds from the next snapshot. No ghosted entities survive a server restart.; `engine inspect --tail N` now applies to plain inspect too, so an agent can ask for \"the last N entities\" without writing a filter.; The HUD's win-state line tells the player how to restart, not just that the round is over."
  ]
}
